review,created_time,sender_id,real_sender_id,message,message_id,type,channel_url,file_url,sender_type
,2025-05-15T18:38:35.694-07:00,psops000_U9_tKva,PhusMY4OaXdFmZLxpK0VBUSDFZz2,"*9764-094279-5639 The item price excludes shipping for this order is $49.00, do you only would like to refund $35?* And you have not yet confirmed this one.",4477170034,MESG,sendbird_group_channel_215482988_4fa48b03f2e105de0efece9e79f6b6a982c07614,,customer_service
,2025-05-15T19:36:04.503-07:00,psops000_U9_tKva,dWAVmWTwgKTxDkvjMw2y5VkwilK2,"Hello, we received a request from the buyer. The buyer, CathyE, has requested that orders 9762-484602-2245, 9762-481772-6615 and 9762-484669-8169 be shipped after June 1, and that current shipments will result in the death of the plants due to the fact that no one is available to sign for them at the place of receipt. Is it possible for you to contact the buyer to follow up?",4477248011,MESG,sendbird_group_channel_215482988_4fa48b03f2e105de0efece9e79f6b6a982c07614,,customer_service
,2025-05-15T21:51:50.247-07:00,WBbobs4hhrcp81MaHYgB8DR6xsv2,,"9764-094279-5639 The item price excludes shipping for this order is $49.00, do you only would like to refund $35?* And you have not yet confirmed this one. Correction let’s refund the $49",4477376015,MESG,sendbird_group_channel_215482988_4fa48b03f2e105de0efece9e79f6b6a982c07614,,user
,2025-05-15T21:59:16.336-07:00,psops000_U9_tKva,dWAVmWTwgKTxDkvjMw2y5VkwilK2,Thank you for your inquiry. Would you like us to refund $49 for order 9764-094279-5639？,4477380783,MESG,sendbird_group_channel_215482988_4fa48b03f2e105de0efece9e79f6b6a982c07614,,customer_service
,2025-05-15T22:00:35.275-07:00,psops000_U9_tKva,tQLRFzDlw0fkLzABAPdIoVKK9OK2,"Hello, Just to confirm, you’re requesting a $49 refund for order #9764-094279-5639, correct? The total amount for this order is $71.69. Please let us know so we can proceed accordingly.",4477381649,MESG,sendbird_group_channel_215482988_4fa48b03f2e105de0efece9e79f6b6a982c07614,,customer_service
,2025-05-16T06:36:48.577-07:00,WBbobs4hhrcp81MaHYgB8DR6xsv2,,"Yes 🌱 Good morning, palm street support To help me communicate with either a supervisor or your team management about our ongoing dilemma with not being able to access any of our funds. it is really urgent matter",4477883969,MESG,sendbird_group_channel_215482988_4fa48b03f2e105de0efece9e79f6b6a982c07614,,user
,2025-05-16T06:40:26.331-07:00,psops000_U9_tKva,kGsNTmWvaLOxY482nRfSp9mJybO2,Hello there. Thank you for reaching out! I have reached out to the finance team. We appreciate the patience!,4477896546,MESG,sendbird_group_channel_215482988_4fa48b03f2e105de0efece9e79f6b6a982c07614,,customer_service
,2025-05-16T11:00:39.249-07:00,WBbobs4hhrcp81MaHYgB8DR6xsv2,,Can you issue a refund on these 3 orders please,4478959095,MESG,sendbird_group_channel_215482988_4fa48b03f2e105de0efece9e79f6b6a982c07614,,user
,2025-05-16T11:00:43.938-07:00,WBbobs4hhrcp81MaHYgB8DR6xsv2,,,4478959452,FILE,sendbird_group_channel_215482988_4fa48b03f2e105de0efece9e79f6b6a982c07614,https://ogcdn.palmstreet.app/chat_source/images/2025-5-16/KZIvoMd.jpg,user
,2025-05-16T11:23:32.384-07:00,WBbobs4hhrcp81MaHYgB8DR6xsv2,,Disregard the first order just the second two needs refunds,4479056895,MESG,sendbird_group_channel_215482988_4fa48b03f2e105de0efece9e79f6b6a982c07614,,user
,2025-05-16T12:01:03.358-07:00,psops000_U9_tKva,kGsNTmWvaLOxY482nRfSp9mJybO2,Hello there. Thank you for reaching out! Full refund?,4479209789,MESG,sendbird_group_channel_215482988_4fa48b03f2e105de0efece9e79f6b6a982c07614,,customer_service
,2025-05-16T12:01:29.465-07:00,WBbobs4hhrcp81MaHYgB8DR6xsv2,,Yes for just the 5331 And 6769,4479211505,MESG,sendbird_group_channel_215482988_4fa48b03f2e105de0efece9e79f6b6a982c07614,,user
,2025-05-16T12:02:26.854-07:00,WBbobs4hhrcp81MaHYgB8DR6xsv2,,And this order 9765-284586-9109 needs a $30 refund,4479215290,MESG,sendbird_group_channel_215482988_4fa48b03f2e105de0efece9e79f6b6a982c07614,,user
,2025-05-16T12:07:28.866-07:00,psops000_U9_tKva,kGsNTmWvaLOxY482nRfSp9mJybO2,All orders have been refunded!,4479237298,MESG,sendbird_group_channel_215482988_4fa48b03f2e105de0efece9e79f6b6a982c07614,,customer_service
,2025-05-16T12:07:36.209-07:00,psops000_U9_tKva,kGsNTmWvaLOxY482nRfSp9mJybO2,Please feel free to contact us if you need further assistance.,4479237892,MESG,sendbird_group_channel_215482988_4fa48b03f2e105de0efece9e79f6b6a982c07614,,customer_service
,2025-05-16T12:12:19.546-07:00,WBbobs4hhrcp81MaHYgB8DR6xsv2,,Thank you,4479257442,MESG,sendbird_group_channel_215482988_4fa48b03f2e105de0efece9e79f6b6a982c07614,,user
,2025-05-16T12:12:23.634-07:00,WBbobs4hhrcp81MaHYgB8DR6xsv2,,Also need these refunded,4479257752,MESG,sendbird_group_channel_215482988_4fa48b03f2e105de0efece9e79f6b6a982c07614,,user
,2025-05-16T12:12:28.785-07:00,WBbobs4hhrcp81MaHYgB8DR6xsv2,,,4479258184,FILE,sendbird_group_channel_215482988_4fa48b03f2e105de0efece9e79f6b6a982c07614,https://ogcdn.palmstreet.app/chat_source/images/2025-5-16/b8Hzbz2.jpg,user
,2025-05-16T12:13:13.94-07:00,WBbobs4hhrcp81MaHYgB8DR6xsv2,,9765-570775-7675,4479261122,MESG,sendbird_group_channel_215482988_4fa48b03f2e105de0efece9e79f6b6a982c07614,,user
,2025-05-16T12:13:51.234-07:00,WBbobs4hhrcp81MaHYgB8DR6xsv2,,9766-157383-2789,4479263649,MESG,sendbird_group_channel_215482988_4fa48b03f2e105de0efece9e79f6b6a982c07614,,user
,2025-05-16T12:14:54.526-07:00,WBbobs4hhrcp81MaHYgB8DR6xsv2,,9765-576156-2142,4479267753,MESG,sendbird_group_channel_215482988_4fa48b03f2e105de0efece9e79f6b6a982c07614,,user
,2025-05-16T12:20:54.455-07:00,psops000_U9_tKva,kGsNTmWvaLOxY482nRfSp9mJybO2,All order have been refunded! Please feel free to contact us if you need further assistance.,4479290670,MESG,sendbird_group_channel_215482988_4fa48b03f2e105de0efece9e79f6b6a982c07614,,customer_service
,2025-05-16T12:40:14.584-07:00,WBbobs4hhrcp81MaHYgB8DR6xsv2,,Can you give this order a $25 refund . Trying to clean up either anything that needed refunds or stuff that didn’t ship to well due to the heat,4479364632,MESG,sendbird_group_channel_215482988_4fa48b03f2e105de0efece9e79f6b6a982c07614,,user
,2025-05-16T12:40:18.662-07:00,WBbobs4hhrcp81MaHYgB8DR6xsv2,,9764-389808-4723,4479364925,MESG,sendbird_group_channel_215482988_4fa48b03f2e105de0efece9e79f6b6a982c07614,,user
,2025-05-16T12:41:53.778-07:00,WBbobs4hhrcp81MaHYgB8DR6xsv2,,9766-089791-3275,4479371041,MESG,sendbird_group_channel_215482988_4fa48b03f2e105de0efece9e79f6b6a982c07614,,user
,2025-05-16T12:42:06.131-07:00,WBbobs4hhrcp81MaHYgB8DR6xsv2,,And 3275 refund that 16,4479371787,MESG,sendbird_group_channel_215482988_4fa48b03f2e105de0efece9e79f6b6a982c07614,,user
,2025-05-16T12:54:16.83-07:00,WBbobs4hhrcp81MaHYgB8DR6xsv2,,"Hello PS 🌱 We’ve completed over 7,200 sales on your platform, built a loyal customer base, and consistently brought strong engagement and traffic to Palmstreet through our niche product line and live sale events. We received a huge financial set back with UPS SURCHARGES which led to a huge delay in our operations. Right now, we’re asking for the opportunity to move forward with a clear plan to stabilize and resume full operations. Since our access to funds was disabled, we’ve continued fulfilling orders using the supplies and resources we already had on hand. However, we are currently operating at a $3,500 negative balance due to a wave of cancellations — many of which happened simply because we couldn’t give customers reliable shipping expectations without knowing when we’d receive our payout. We also have $5,000 in pending funds that are vital to covering our operational costs: shipping materials, staffing, and order prep. We’ve taken immediate steps to reduce new order intake while prioritizing the fulfillment of all open orders. We’ve tightened internal systems, reinforced inventory controls, and have made it a point to remain transparent and communicative with our customers during this entire situation. Our packing team is fully functional and ready to move forward. The infrastructure is already in place — we just need access to the funds we’ve already earned. Palmstreet has built its brand around supporting small businesses like mine. We’re not asking for sympathy — we’re showing you that we’re already doing the hard work to stay accountable and protect our reputation, and yours. We’re ready to continue operating responsibly, and we’re asking for the opportunity to do so. If there’s any information or documentation you need from me to move this forward, I’m more than willing to provide it. I truly believe Rare Plant Obsession has been — and will continue to be — a valuable asset to the Palmstreet platform. Thank you for your time and consideration. Sincerely, Melissa Gomez Rare Plant Obsession",4479419535,MESG,sendbird_group_channel_215482988_4fa48b03f2e105de0efece9e79f6b6a982c07614,,user
,2025-05-16T12:59:58.612-07:00,psops000_U9_tKva,kGsNTmWvaLOxY482nRfSp9mJybO2,Both order have been refunded!,4479441237,MESG,sendbird_group_channel_215482988_4fa48b03f2e105de0efece9e79f6b6a982c07614,,customer_service
,2025-05-16T13:52:04.344-07:00,WBbobs4hhrcp81MaHYgB8DR6xsv2,,I need a $30 refund on this order also,4479625145,MESG,sendbird_group_channel_215482988_4fa48b03f2e105de0efece9e79f6b6a982c07614,,user
,2025-05-16T13:52:06.06-07:00,WBbobs4hhrcp81MaHYgB8DR6xsv2,,9765-994934-1642,4479625276,MESG,sendbird_group_channel_215482988_4fa48b03f2e105de0efece9e79f6b6a982c07614,,user
,2025-05-16T15:27:36.598-07:00,WBbobs4hhrcp81MaHYgB8DR6xsv2,,Hello PS support🌱 I appreciate your attention to this matter. We are awaiting a response from your finance team. We would like to resume our operations so we can continue to sell and fulfill our orders on Palmstreet,4479907063,MESG,sendbird_group_channel_215482988_4fa48b03f2e105de0efece9e79f6b6a982c07614,,user
,2025-05-16T16:43:54.843-07:00,psops000_U9_tKva,PhusMY4OaXdFmZLxpK0VBUSDFZz2,Partially refunded $30 for the order 9765-994934-1642 based on your request.,4480057116,MESG,sendbird_group_channel_215482988_4fa48b03f2e105de0efece9e79f6b6a982c07614,,customer_service
,2025-05-16T19:40:29.597-07:00,WBbobs4hhrcp81MaHYgB8DR6xsv2,,"This has cost our business thousands of dollars. I can’t even count how many cancellations and refunds to orders I could have fulfilled if not placed under these restrictions which was done without any notice. I have not been able to provide for my family, which frankly seems to only be a concern to me. I am being constantly asked to continue our shop without any access to our funds. Along with being bounced around every time I ask for a direct communication. I have been pleading the case for my shop for 26 days . I’m sure you have all been made aware of the big red flag above my business. I could have fulfilled all my orders. Palmstreet is making it very difficult borderline impossible to fulfill our orders with no payment timeline. We were originally warned to clean up the back log or we risked losing early payout. We followed through and began reviewing all current orders, in transit and label created. We have worked with Palmstreet support to correct all incorrect tracking numbers and orders that remained open due to incorrect trackings input on the system. Followed by shipping orders and and having those funds payout reversed. All payments disable with the condition to continue to ship and fulfill orders in a timely manner. Followed by thousands of dollars of orders cancelled and refunds because without access to funds we cannot operate our business properly. I cannot even count how many of my customers were affected by this. Yet I cannot tell them we have their plants but Palmstreet is withholding funds so we cannot ship the product. We cannot be expected sell and ship without any payment plan for 26 days. My customers are my priority and this has cause in reconcilable damages already to our shop. Every cancelled order and refund that has been caused because our shop was unable to resume operations. My team has been sent home for 26 days. We would like fulfill orders so we can make our customers happy. I have always been so proud to be apart of Palmstreet. Proud of the community we were building and the relationships I have built on this app. Can someone here call someone who give us a plan of action for payment because this situation is incomprehensible. call someone",4480291069,MESG,sendbird_group_channel_215482988_4fa48b03f2e105de0efece9e79f6b6a982c07614,,user
,2025-05-17T07:24:41.832-07:00,psops000_U9_tKva,kGsNTmWvaLOxY482nRfSp9mJybO2,Hello there. Thank you for reaching out! I have forward the information to our internal team. We appreciate the patience!,4480778162,MESG,sendbird_group_channel_215482988_4fa48b03f2e105de0efece9e79f6b6a982c07614,,customer_service
,2025-05-17T11:02:28.599-07:00,WBbobs4hhrcp81MaHYgB8DR6xsv2,,Hello PS support I need an email for direct communication with your finance and legal department. I emailed the “ risk management team with no result”. Thanks for reaching out. We appreciate your attention to this matter.,4481169967,MESG,sendbird_group_channel_215482988_4fa48b03f2e105de0efece9e79f6b6a982c07614,,user
,2025-05-17T16:53:08.092-07:00,WBbobs4hhrcp81MaHYgB8DR6xsv2,,PS SUPPORT I need communication as soon as possible.,4481693872,MESG,sendbird_group_channel_215482988_4fa48b03f2e105de0efece9e79f6b6a982c07614,,user
,2025-05-18T00:06:26.752-07:00,psops000_U9_tKva,dWAVmWTwgKTxDkvjMw2y5VkwilK2,"We have reported this feedback to the team and will contact you as soon as possible. In the meantime, the buyer Aqua.labz has requested to cancel his 17 orders due to the long shipping time. We will cancel them for the buyer if they are not shipped for more than 24 hours, thank you for your support and understanding",4482027281,MESG,sendbird_group_channel_215482988_4fa48b03f2e105de0efece9e79f6b6a982c07614,,customer_service
,2025-05-18T08:43:45.031-07:00,WBbobs4hhrcp81MaHYgB8DR6xsv2,,PS support I am starting day 4 of asking for support and communication. I’m being asked to resume operations and a big concern is the lack of direct communication. This is exactly what I mean. At least 4 + people are aware of this current situation yet no one is communicating with me. The eye roll and groans when my messages bounced around. Melissa.lily907@gmail.com 941-214-6890 I have been placed in a impossible situation and still emphasis every step of the way that this whole situation has been mismanaged. I would like to be reinstated and resume our operations. I need all access to my income and my orders. I am honestly exhausted of uncertainty this situation has caused. I have always been so proud of watching plantstory become what Palmstreet is becoming. It was starting to be everything I dreamed of. I still am very proud of what Palmstreet. I want to believe that Palmstreet supports small business and this situation has just been mismanaged. I want to believe that Melissa Gomez 🌱,4482390663,MESG,sendbird_group_channel_215482988_4fa48b03f2e105de0efece9e79f6b6a982c07614,,user
,2025-05-18T14:13:53.402-07:00,psops000_U9_tKva,slye9fDi8mcqmseHdfhofdTtX2q1,"Hi Melissa, Thank you so much for reaching out, and I’m truly sorry for the delay and the frustration this situation has caused. We completely understand how important clear communication and timely support are—especially when your business and livelihood are on the line. Please know that your concerns have been heard. Your point of contact has been made fully aware of your case and will be reaching out to you by end of day tomorrow to continue the conversation and work toward a resolution. We appreciate your patience and the thoughtful way you’ve expressed your experience. Your dedication to the Palmstreet community means a great deal to us, and we’re committed to making things right. Warmly, Palmstreet Support",4482920586,MESG,sendbird_group_channel_215482988_4fa48b03f2e105de0efece9e79f6b6a982c07614,,customer_service
,2025-05-19T12:19:05.715-07:00,WBbobs4hhrcp81MaHYgB8DR6xsv2,,I appreciate your response. I would like to know who my point of contact is ? Account manager ? Whom am I to speak too exactly,4485639655,MESG,sendbird_group_channel_215482988_4fa48b03f2e105de0efece9e79f6b6a982c07614,,user
,2025-05-19T17:10:16.723-07:00,WBbobs4hhrcp81MaHYgB8DR6xsv2,,💚,4486603366,MESG,sendbird_group_channel_215482988_4fa48b03f2e105de0efece9e79f6b6a982c07614,,user
,2025-05-19T17:39:39.695-07:00,WBbobs4hhrcp81MaHYgB8DR6xsv2,,Hello Palmstreet support 🌱 We need assistance with an order,4486657680,MESG,sendbird_group_channel_215482988_4fa48b03f2e105de0efece9e79f6b6a982c07614,,user
,2025-05-19T18:00:56.772-07:00,psops000_U9_tKva,slye9fDi8mcqmseHdfhofdTtX2q1,"Hi RarePlantObsession, Thanks so much for reaching out to Palmstreet Support! 🌱 We’d be happy to assist you—could you please share a bit more detail about the order or issue you’re experiencing? Whether it’s an order number, delivery concern, or anything else, the more context you can provide, the quicker we’ll be able to help. Looking forward to your reply—we’re here for you every step of the way! 😊",4486694318,MESG,sendbird_group_channel_215482988_4fa48b03f2e105de0efece9e79f6b6a982c07614,,customer_service
,2025-05-19T18:12:16.847-07:00,WBbobs4hhrcp81MaHYgB8DR6xsv2,,Thank you so much for getting back to me 🌱 Order 9765-134748-5075 Note The order included an Alocasia Loco that did not have pass our shipping standards. There were leaf loss and did not accurately resemble the plant at the point of of purchase. It was not included in the shipment and we would like it refunded $25 total We reached out to the customer to let them know we would address this with Palmstreet support. Thank you 🌱,4486715399,MESG,sendbird_group_channel_215482988_4fa48b03f2e105de0efece9e79f6b6a982c07614,,user
,2025-05-19T18:14:17.418-07:00,psops000_U9_tKva,slye9fDi8mcqmseHdfhofdTtX2q1,"Hi RarePlantObsession, Thank you so much for the detailed explanation—and we appreciate your care in maintaining high shipping standards. Just to confirm, are you requesting that we apply a $25 partial refund to order 9765-134748-5075 for the Alocasia Loco, which was not included in the shipment due to its condition? Once we have your confirmation, we’ll proceed with the refund right away. Thanks again for being proactive and transparent—we’re here to support you every step of the way! 🌱",4486718692,MESG,sendbird_group_channel_215482988_4fa48b03f2e105de0efece9e79f6b6a982c07614,,customer_service
,2025-05-19T18:15:23.24-07:00,WBbobs4hhrcp81MaHYgB8DR6xsv2,,Yes a $25 refund for the order 9765-134748-5075 for the Alocasia loco that was not included in their shipment.,4486720506,MESG,sendbird_group_channel_215482988_4fa48b03f2e105de0efece9e79f6b6a982c07614,,user
,2025-05-19T18:17:09.798-07:00,WBbobs4hhrcp81MaHYgB8DR6xsv2,,I will await contact from my POC. Which I’m still unsure whom that is exactly. Thank you for responding right away tho ! I appreciate it 😅🌱💚,4486723448,MESG,sendbird_group_channel_215482988_4fa48b03f2e105de0efece9e79f6b6a982c07614,,user
,2025-05-19T19:08:11.657-07:00,psops000_U9_tKva,dWAVmWTwgKTxDkvjMw2y5VkwilK2,Thanks for reaching out. 9765-134748-5075 has been refunded $25,4486802483,MESG,sendbird_group_channel_215482988_4fa48b03f2e105de0efece9e79f6b6a982c07614,,customer_service
,2025-05-19T19:11:16.605-07:00,psops000_U9_tKva,dWAVmWTwgKTxDkvjMw2y5VkwilK2,"Regarding your POC, our relevant colleague will contact you tomorrow to communicate with you. Thank you for your support and understanding!",4486806452,MESG,sendbird_group_channel_215482988_4fa48b03f2e105de0efece9e79f6b6a982c07614,,customer_service
,2025-05-19T19:32:41.71-07:00,psops000_U9_tKva,dWAVmWTwgKTxDkvjMw2y5VkwilK2,"We apologize for the inconvenience. Due to the long period of time without reply or response from buyer Aqua.labz, 17 orders will be canceled. Thank you for your support and understanding!",4486837118,MESG,sendbird_group_channel_215482988_4fa48b03f2e105de0efece9e79f6b6a982c07614,,customer_service
,2025-05-19T19:36:39.691-07:00,WBbobs4hhrcp81MaHYgB8DR6xsv2,,Thank you for your help. We don’t have access on our end.,4486842600,MESG,sendbird_group_channel_215482988_4fa48b03f2e105de0efece9e79f6b6a982c07614,,user
,2025-05-19T19:40:05.389-07:00,psops000_U9_tKva,dWAVmWTwgKTxDkvjMw2y5VkwilK2,Thank you for your response. We will process the refund for the buyer,4486846725,MESG,sendbird_group_channel_215482988_4fa48b03f2e105de0efece9e79f6b6a982c07614,,customer_service
,2025-05-20T04:08:49.316-07:00,psops000_U9_tKva,YYYmiKehdrgmbt20nSHimEtEIgQ2,"We’ve received a claim from the buyer under the Late Delivery Protection program, and the package was lost in transit. Buyer name: GiveMeYoPlantz Tracking number: 1ZH4G1301235970714 Order number: all orders in the package We’d like to get this worked out so that our buyers continue to have confidence in purchasing on Palmstreet and you. Option 1: Refund/Replacement If you choose to issue a refund or replacement, Palmstreet will cover 50% of the item price and 100% of the shipping costs, $160/2+$40, totaling $120, meaning you will only be responsible for 50% of the item price. Option 2: No Refund/Replacement If you choose not to refund or replace, Palmstreet will work with the buyer to find other solutions. Please confirm how you would like to proceed. Please note that we respect the seller’s policies, and refunds can only be issued with their approval. Learn more about Late Delivery Protection: https://palmstreet.app/blog/palmstreet-package-protection-policies If you have any questions, feel free to reach out to us.",4487194442,MESG,sendbird_group_channel_215482988_4fa48b03f2e105de0efece9e79f6b6a982c07614,,customer_service
,2025-05-20T05:54:36.919-07:00,WBbobs4hhrcp81MaHYgB8DR6xsv2,,"I agree we should resolve this for I the customer. As mentioned to the customer we purchased a third party label via PALMSTREET and cannot file a claim for the value of the order on behalf of the customer. The package was shipped by us in a timely manner. Unfortunately California has a reputation for being a pain with receiving packages. As far as the options mentioned above, mutual loss proposal. An additional $80 dollar deduction to help satisfy the customer at this point I believe would be the decent plan to go with. I also appreciate the sentiment that someone actually had the time and decency to talk to me and explain this situation to me. I appreciate you getting back to me in a timely manner. I am happy the customer is getting a resolution. I do have a question though",4487413873,MESG,sendbird_group_channel_215482988_4fa48b03f2e105de0efece9e79f6b6a982c07614,,user
,2025-05-20T06:50:04.358-07:00,WBbobs4hhrcp81MaHYgB8DR6xsv2,,We will proceed with Option 1 🌱,4487620048,MESG,sendbird_group_channel_215482988_4fa48b03f2e105de0efece9e79f6b6a982c07614,,user
,2025-05-20T07:38:29.385-07:00,psops000_U9_tKva,OAbMBqI0tpVcDaDpSjg81UMrrHu1,We will refund the buyer in full and add $120 to your seller account today. Thank you for the quick response!,4487827453,MESG,sendbird_group_channel_215482988_4fa48b03f2e105de0efece9e79f6b6a982c07614,,customer_service
,2025-05-20T08:56:48.677-07:00,WBbobs4hhrcp81MaHYgB8DR6xsv2,,PS support I need assistance 🌱,4488197649,MESG,sendbird_group_channel_215482988_4fa48b03f2e105de0efece9e79f6b6a982c07614,,user
,2025-05-20T09:07:30.489-07:00,psops000_U9_tKva,OAbMBqI0tpVcDaDpSjg81UMrrHu1,What do you need help with?,4488258836,MESG,sendbird_group_channel_215482988_4fa48b03f2e105de0efece9e79f6b6a982c07614,,customer_service
,2025-05-20T12:33:58.207-07:00,WBbobs4hhrcp81MaHYgB8DR6xsv2,,"Yes I have been waiting for my internal team/ finance team/ point of contact /and or relevant colleague to communicate with me. I really have to proceed resuming our operations. We have a staff, 50 orders for customers all awaiting a resolution. These are vital shipping fulfillment days. Can you let whom ever was suppose to contact me to contact me soon. Via here or email Melissa.lily907@gmail.com I really just rather get back to work and stop this back and forth. I have a proposal if they have the time Thanks.",4489251527,MESG,sendbird_group_channel_215482988_4fa48b03f2e105de0efece9e79f6b6a982c07614,,user
,2025-05-20T12:56:34.282-07:00,psops000_U9_tKva,OAbMBqI0tpVcDaDpSjg81UMrrHu1,"Your POC Angalena texted you yesterday and got no reply. Do you perhaps have a new phone number? If you'd like to share your proposal, we'd be happy to share it.",4489349214,MESG,sendbird_group_channel_215482988_4fa48b03f2e105de0efece9e79f6b6a982c07614,,customer_service
,2025-05-20T13:15:33.906-07:00,WBbobs4hhrcp81MaHYgB8DR6xsv2,,I will reach out directly thank you 🌱,4489433736,MESG,sendbird_group_channel_215482988_4fa48b03f2e105de0efece9e79f6b6a982c07614,,user
,2025-05-20T15:00:44.343-07:00,psops000_U9_tKva,WmOtwmWCRiSOOvxqZ4v0VxDYYjw2,"Of course! if you need assistance with anything else please let us know, we are happy to assist!",4489823911,MESG,sendbird_group_channel_215482988_4fa48b03f2e105de0efece9e79f6b6a982c07614,,customer_service
,2025-05-21T06:10:02.083-07:00,WBbobs4hhrcp81MaHYgB8DR6xsv2,,Hello Palmstreet support I need assistance 🌱,4491059640,MESG,sendbird_group_channel_215482988_4fa48b03f2e105de0efece9e79f6b6a982c07614,,user
,2025-05-21T11:29:38.712-07:00,WBbobs4hhrcp81MaHYgB8DR6xsv2,,Palmstreet support i need an assistance with this,4492460807,MESG,sendbird_group_channel_215482988_4fa48b03f2e105de0efece9e79f6b6a982c07614,,user
,2025-05-21T11:46:38.221-07:00,WBbobs4hhrcp81MaHYgB8DR6xsv2,,Palmstreet support I need assistance with order 8997,4492535567,MESG,sendbird_group_channel_215482988_4fa48b03f2e105de0efece9e79f6b6a982c07614,,user
